{ "schemaVersion": 1, "success": true, "query": "Wedgwood jasperware vase", "sort": "relevance", "ranking": "auction-search-v1", "lots": [{ "schemaVersion": 1, "lotUid": "fixture-lot-1", "title": "Wedgwood Jasperware Vase", "priceRealised": 850, "currency": "USD", "rankingScore": 3.75, "assetStatus": "available", "assetVerifiedAt": "2026-07-13T00:00:00.000Z", "imageUrl": "https://assets.appraisily.com/auction-lots/example/thumb/example.jpg" }], "nextCursor": null, "source": "auction_data_api" }
